name,category,Address,phone
,,0,
,,0,
Dreamwarez,Software company,behind Tip Top Intl Hotel,091300 81817
"Navkar Dreamsoft - Best Software Company for CRM, BEST GYM SOFTWARE",Software company,"Office No - 328,3rd Floor, KHINVASARA TRADE CENTER, KTC"" Dange Square, Datta Mandir Rd",099603 01201
ABNScripts Technologies Pvt. Ltd.,Software company,"Office No. 201, 2nd Floor, Royal 18 Near Mayureshwar Ganesh Mandir, Mayur Baug Colony, Dange Chowk Rd",088883 35958
Millionis Tech,Software company,"2nd floor, Dange Chowk Rd, above HDFC Bank, near Pandit petrol pamp",089751 25923
Thinkitive Technologies Private Limited,Software company,"4th Floor, ABIL IMPERIAL COMMERCIAL SPACES, Rohan Seher Ln, near Murkute Garden",089564 67327
ANV Infosystem Pvt.Ltd.,Software company,"2nd Floor, Mahalakshami Complex, Dange Chowk Rd",091756 88662
"Midbrains Technologies - IT Solutions & Digital marketing Company in Wakad, Pune",Software company,"2nd floor, Dange Chowk Rd, above HDFC Bank, near Pandit Petrol Pump",091727 11103
LogicoWise Systems Pvt. Ltd.,Software company,"B-208 LaxmiTara Market, Near Sonigara Park Dange Chowk Road, Dange Chowk",074480 80044
Linescripts Softwares Pvt. Ltd.,Software company,"Office Number 402, Commercial Complex, Five Gardens Rd",089898 22828
CodesCastle Software Pvt. Ltd.,Software company,"502, Fortune Business Centre",084080 88550
Earthcon infotech It company,Software company,"Office No. : 201, 2nd Floor, Pristine Square, behind phoenix mall",077700 25668
SachCloudy Solutions - Software Company in Pune,Software company,"Office 401, Vardhman Moonstone Buzzz, Bengaluru - Mumbai Hwy, opp. JSPM College",080071 19009
Accucia Softwares Pvt Ltd,Software company,"Office No.304, 3rd Floor, Sanskriti Arcade, near PCMC School",088838 32222
TechnoSignia,Software Training Institute,"Floor 2nd, 21 Square, Kalewadi phata road, beside signature park, near Dange Chowk Road",076201 85581
Soft The Next,Software company,"1104, 11th Floor, Ivory Tower, Satara Rd, above Tanishq",096576 07280
Lokstech | Software Company in Pune,Software company,"Office No. 310, Crossroads, Bhumkar Chowk, Mumbai-Bangalore Express Highway",084595 30571
MPLUSSOFT,Software company,"4014 - 4013, Fourth Floor, Ganga Trueno Business Park, New Airport Rd",084596 30022
ScroBits Technologies,Software company,"Scrobits Technologies, S.no - 155 , Adhiraj Bussiness complex 4th floor office no, 402-403",096070 20806
Ultraskills IT Solutions Pvt Ltd,Software company,"City Avenue, Office 214, Mumbai Bangalore, Highway",
Probus Software Private Limited,Software company,"Office No 412, 4th Floor, Pride Purple Square",086050 09800
Deinertech Software Private Limited,Internet marketing service,"Crossroads Survey, 130/123, Service Rd",092092 98516
Dreamwarez,Software company,behind Tip Top Intl Hotel,091300 81817
Stringcode Technologies,Software company,"SR NO .16, Pune City ( M crop",070306 03818
Blucor Systems Pvt Ltd,Software company,"Office No 202/211,Zen Business Centre ,Bhumkar Chowk",080804 25907
Onyx Software Solutions,Software company,"Office No 316 Crossroads, Bhumkar Chowk",089291 30516
SiGa Systems,Software company,"Metropole, Thergaon Near BRT Bus Stop, Dange Chowk First Floor, Office No 101",088735 11171
Aarvi WebTech Solutions,Software company,"KTC), Office, KHINVASARA TRADE CENTER, 315, Datta Mandir Rd",099219 91405
Ascent Software Solutions | Since 2010,Software company,"Office No- 7, 2nd floor, Phule Vihar Society, Pune - Satara Rd, opposite BSNL Office, near Panchami Hotel of",090750 56050
Zenture IT Solutions,Software company,"IIEDC, Aissms ioit, near RTO",086690 08757
Ennovata Sales & Services Pvt. Ltd.,Software company,"3, Jainam Tower, 3, Sai Park, Belthika Nagar, Thergaon",073856 73856
Bitwise Solutions Pvt. Ltd.,Software company,"Bitwise, Bitwise Terratower, Mumbai Pune Bypass Rd Flyover",020 4010 2000
eHealthFlex Technologies Private Limited,Software company,"411, Crossroads, Bhumkar Chowk",091750 40052
POSIVIEW DIGITAL TECHNOLOGIES PVT. LTD.,Software company,"3rd Floor, Onyx Business Park, Pink City Road Kaveri Nagar, Wakad, Pimpri-chinchwad",
ScriptsHub Technologies Pvt. Ltd.,Software company,"Office No 501, 5th Floor, CityAvenue - By Kolte Patil Mumbai-Banglore By Pass, near Hotel Sayaji",082085 29257
Best SAP HANA Implementation Partner in India | Software Company in Pune | Atorix IT Company,Software company,"3rd Floor, Office No. C, Police, Wireless Colony, 305, New DP Rd",089560 01555
Yohita Technologies,Software company,"Office No. 221, KHINVASARA TRADE CENTER",094231 77880
PureEco Tech Solution,Software company,"49/6, Uttamshanti, Third Floor, Hinjewadi IT Park Road, Dange Chowk,Tathwade, 411033, near Pandit Petrol Pump",089830 86204
Gunadhya Software Solutions Pvt Ltd,Software company,"Office 302, M-Arch Center, Pashan - Sus Rd",091300 81345
"Infoshard Technologies Pvt. Ltd., Pune",Software company,"Office No. 2, Radha Heights, Near HP Petrol Pump Tathawade BRT Road, Dange Chowk, Chinchwad",083295 56560
"WeSolutize Technologies | Top AI Solution Provider | Top Software Development | Hospital Management | Company Pune, India.",Software company,"City Center Building, Hinjawadi Phase 1 Rd",
PTC Software (India) Pvt. Ltd.,Software company,0,020 6605 3000
P-webcraft Technology,Software company,"KHINVASARA TRADE CENTER, 301, Dange Chowk Rd",084598 82210
Tej IT Solutions India Pvt Ltd.,Software company,"Office No. 103, Phoenix Building, Bund Garden Rd, opp. Residency Club",020 2995 2744
Abhishek Mane IT Services,Software company,"Flat No 202, Sadguru Vihar, Lane No. 3",086260 73884
5D Solutions India Pvt. Ltd.,Software company,"#401, Baner Rd",085307 36130
Woyce Technologies And Services,Software company,"Office No. 6-7 Level 2, Hermes Palazzo, opp. St Anne's School",098900 39265
"ImageGrafix Software Solutions Pvt Ltd, Pune",Software company,"W-Biz' Building, F-204, Bhumkar Chowk Rd, near Vision One Mall, behind GINGER HOTEL",097697 41265
Xoyal It Services,Software company,"Phase 1, Boulevard Tower, Office 208, near, Sadhu Vaswani Chowk",098601 83377
Alchemist Softwares Pvt Ltd,Software company,"1st Floor, Lara Building, Sadhu Vaswani Chowk, near Woodland Hotel",020 4130 2020
Mobicool Software Solutions,Software company,"Office No.13, Akshay Centre, opp. Abc Nirman Building, behind McDonalds",080809 93487
Codiastic Soft-Software and mobile app development pune,Software company,"First Floor, Balaji Heights, opp. Ranade School, near Omkareshwar mandir",092848 74955
Searce° | Pune,Software company,"IT-06, 6th Floor, Qubix Business Park SEZ, Blue Ridge Approach Road",
Infopeer Software Solutions,Software company,"Office No: 313, Third Floor, 411033, near 16 Number Bus Stop",085307 73548
i-Softinc - Mobile App Development Company in Pune,Software company,"Govinda Room no: C3 third floor reddys Pg, near HP petrol pump Hinjewadi",099717 31257
QSpiders| JSpiders | PySpiders Pune Wakad,Software Training Institute,"The Hub, 4th floor, Dange Chowk Rd",078999 22666
Centre for Computational Technologies Pvt. Ltd. (CCTech),Software company,"403, Puspak Business Hub, New, Mumbai - Pune Expy",074474 77868
Zensoft Services Pvt. Ltd.,Software company,"6th Floor, Sai Radhe Complex Sangamvadi, Kennedy Road, Behind Sheraton Grand (Old LE Meridian)",020 6647 9400
ThinkSmart IT Solutions Pvt Ltd - Phase 1 office,Software company,"City Center, 14,138/ I, Hinjawadi Phase 1 Rd",020 6522 0908
Intellicloud Solutions Private Limited,Software company,"VTP Altitude, 401-406, Dange Chowk Rd, next to Shell Petrol Pump",
Qualys,Software company,"Survey No. 20, Tower B, Panchshil Business Park, 10th to 16th Floor",
Scan-IT Solution (India) Pvt. Ltd.,Software company,"602-603, SAI RADHE COMPLEX, Plot no 100-101, behind Shereton Hotel",
MLM Software Developer in Pune,Software company,0,099010 60627
axas software development - pune,Software company,"Sky Loft, CREATICITY MALL, off Airport Road, opposite golf course",073968 19919
Just Logic Software pvt ltd,Software company,"City Centre,Office no 17, Floor no:2",088570 11185
Sankalp Computer & Systems Pvt. Ltd.,Software company,"Sr. No.- 440/441, First Floor Narpatgiri Chowk, opposite to Ladkat Petrol Pump",020 4106 2300
Golden Eagle IT Technologies - AI Services | custom Software Development Company in Pune,Software company,"4th Floor, Keystone Altura",
Bitla Software Pvt Ltd Pune,Software company,"28A/1, Jawaharlal Nehru Rd",080 4640 0215
Yashojas Softech services pvt ltd,Software company,"building, bus stop, office no. 8 wakad center, near by Bhumkar Bridge",082757 48200
Applikon IT Solutions Pvt.Ltd,Software company,"7th Floor, Office, City Avenue, 719, Bengaluru - Mumbai Hwy",
Opstech Solution Pvt. Ltd - Website Design in Pune I SEO Company in Pune,Website designer,"Sankalp Apt 2nd floor, Office No- 203, Aundh-Wakad Rd, above Monginish Cake Shop, near Copa Cobana Restaurant",091300 85667
VITTECH PVT. LTD.,Software company,"Office-No 310, 10 Biz Park, next to Symbiosis Law School",080 6871 5488
"Explicate Technologies | Software Development, Mobile App, Website Design, Cloud Service, ERP Software Company in Pune",Software company,0,
Entytle India Pvt Ltd - Camp,Software company,"2nd Floor, Nucleus Mall, AWFIS Space Solutions Pvt.Ltd, 1st Church Rd, opposite Commissioner Office",0512 436 3202
Nexus Software System,Software company,"Office No 202B, 2nd Floor, Ashoka Pavilion, Dr Baba Saheb Ambedkar Rd",
"Naksh Technologies - Best Website Design & Website Development Company in Pune, Digital Marketing Company in Pune",Software company,"Office No 303,3rd Floor, Siddhivinayak Keshar, 431, Station Rd, near Old Zilla Parishad",086682 38570
TalentServ Consulting Private Limited,Software company,"32A/1, Shree Krishna Spaces",020 6410 8300
Hexagon Manufacturing Intelligence India Pvt. Ltd.,Software company,"Unit No. 101-105, 1st Floor 100+101, Kennedy Road Behind Grand Sheraton",020 6763 9100
"Commvault Systems India Pvt.Ltd, Pune",Software company,"HQX4+RV2, Hinjawadi Road",
Arisikey Technologies,Software company,"208, near GOPI MEDICAL",099706 12701
Locusnine Innovations Private Limited - A Verto Company,Software company,"8th floor, Suyog Platinum Tower, Naylor Rd, off Mangaldas Road",
Mahalaxmi Technologies - Best Website Developement Company In Pune,Software company,228,085509 06117
Sphinx Solutions,Software company,"6th Floor, Olympia Mumbai Bangalore Highway Baner-411045, near Supreme HQ",020 2970 1664
Devnco Technologies Pvt Ltd,Software company,"Office no 304, Gera Chambers Building, Boat Club Rd",086001 48819
Radius Tech Park,Software company,0,1800 121 9090
Constellation Software & Consulting Pvt Ltd,Software company,"Greens Center, O403",099229 02720
F5 Web Solutions,Software company,"216 Aurora towers, East wing, 2nd floor",
NADSOFT,Software company,"NADSOFT, 173, Nalin Chambers on Second Floor, Dholepatill Road, OR, near Kapila Hotel, near ganpati temple",080874 29395
Software Development Company - Microzen Technologies,Software company,Aurora Towers,077540 71717
MakeB Tech,Software company,"Aurora Towers, E wing",099871 21730
Adiasquare Software Solutions OPC Pvt.Ltd.,Software company,"Office No:503,5th Floor, Navale Icon, Bengaluru - Mumbai Hwy, near Navale Bridge",090221 35865
MosChip® Technologies - Pune,Software company,"2nd Floor, Block C, Tech Park One, iSprout Business Center, Panchshil",079 3533 8580
Agiliad Technologies Pvt. Ltd.,Software company,"First Floor, GODREJ CASTLEMAINE, 42, Sasoon Rd",020 6689 1222
Software Technology Parks of India,Government office,"Plot No P1, MIDC, Hinjawadi Phase 1 Rd",020 2298 1000
Qualitia Software Pvt. Ltd.,Software company,"6th Floor, SAI RADHE COMPLEX, Unit 601, Raja Bahadur Motilal Rd, behind Sheraton Grand Pune Bund Garden Hotel",020 6727 8200
Zainton Technologies | Best Web Design & Website Development Company In Pune | Digital Marketing Agency In Pune,Software company,"Office No 303, 3rd Floor, Siddhivinayak Keshar, 431, Station Rd, near Old Zilla Parishad",098812 33932
AADS TECH SERVICES PRIVATE LIMITED,Software company,"A-404 Silver Twin, Vision One Mall, Bhumkar Chowk Rd, near GINGER PUNE",077373 23421
Dss Systems & Software Technologies Pvt. Ltd.,Software company,"Nalin Chambers, 173, Balkrishna Sakharam Dhole Patil Rd",020 2616 2501
Clover Infotech Private Limited,Software company,"No. 5, Clover Centrum, 245, Boat Club Rd",
Amplesys technologies-GST Billing and Accounting Billing Software In Pune|Restaurant Management Software|POS Software In Pune,Software company,"Office #231, 2nd Floor, Sterling Centre, MG Road, opposite Aurora Towers",080 4803 6111
KogniVera IT Solutions Pvt Ltd - Pune,Software company,"8th Floor, Kumar Business Centre, 802, Bund Garden Rd",
Sir,Software company,"1st Floor Metro 9, Aundh - Ravet BRTS Rd, opp. Park Street",085509 92001
DemandFarm,Software company,"Plot No. 100, The Hive, 101/1, Raja Bahadur Mill Rd, behind Sheraton Grand Pune Bund Garden Hotel",
MosChip® Technologies - Pune,Software company,"2nd Floor, Block C, Tech Park One, iSprout Business Center, Panchshil",079 3533 8580
Agiliad Technologies Pvt. Ltd.,Software company,"First Floor, GODREJ CASTLEMAINE, 42, Sasoon Rd",020 6689 1222
Qualitia Software Pvt. Ltd.,Software company,"6th Floor, SAI RADHE COMPLEX, Unit 601, Raja Bahadur Motilal Rd, behind Sheraton Grand Pune Bund Garden Hotel",020 6727 8200
AADS TECH SERVICES PRIVATE LIMITED,Software company,"A-404 Silver Twin, Vision One Mall, Bhumkar Chowk Rd, near GINGER PUNE",077373 23421
KogniVera IT Solutions Pvt Ltd - Pune,Software company,"8th Floor, Kumar Business Centre, 802, Bund Garden Rd",
Sir,Software company,"1st Floor Metro 9, Aundh - Ravet BRTS Rd, opp. Park Street",085509 92001
DemandFarm,Software company,"Plot No. 100, The Hive, 101/1, Raja Bahadur Mill Rd, behind Sheraton Grand Pune Bund Garden Hotel",
Zexus Technologies,Software company,Closed,072764 47044
Sarla Advantech Private Limited,Software company,"GODREJ CASTLEMAINE, 601 & 602, Sasoon Rd, behind Ruby Hall Clinic",020 6728 2000
Shipco IT Pvt. Ltd.,Software company,"Sai Radhe, 602-603, Plot No 101-102, Behind Sheraton Hotel, near Pune Station",090280 67594
Zinnia Digital Service- Pune Campus,Technology park,701 & 702,020 6766 0100
Gateway Group of Companies - Pune,Software company,·,020 6522 9900
Sepadu Tech Pvt Ltd,Engineering consultant,"4th Floor, Office Towers, Office no.421,422,Vision One Mall, 403, Bhumkar Chowk Rd, near Ginger Hotel",098504 13122
MLM Software Company Pune | Website Development Company,Software company,0,
SP IT Technologies - IT Support & Firewall Services in Pune,Computer support and services,"Office- 207, 2nd floor, Parmar Trade Centre, B Wing, Sadhu Vaswani Chowk",098907 52904
QuantumID India (Pvt) Ltd.,Software company,"301, Manikchand Ikon, Phase 1, Dhole Patil Road",020 6620 4640
Maharashtra Informatics Opc Pvt Ltd,Software company,"Office No 1034, Gera Imperium Rise, opposite Wipro Circle",093734 99415
ND GYM SOFTWARE - BEST GYM SOFTWARE,Software company,"office no. 328, KHINVASARA TRADE CENTER, Athavan chowk, Datta Mandir Rd",099603 01201
Empower Integrated Solutions (P) Ltd.,Software company,"The Hive -The Mills at RBCC, Raja Bahadur Motilal Rd, behind Sheraton Grand Pune Bund Garden Hotel",020 4902 2020
Hardcastle GIS Solutions Pvt Ltd,Software company,"B-10 Hive,The Mills at RBCC, Raja Bahadur Mill Rd, behind Sheraton Grand Hotel",096650 50993
Tech Career Solution,Recruiter,"Ganesh Mandir Hinjewadi Road, Near, Dange Chowk Rd",072767 56905
Inspirria Cloudtech Private Limited,Software company,"SAI RADHE COMPLEX, 5th Floor, Wing B, Raja Bahadur Motilal Rd, behind Hotel Sheraton Grand",44394251
MLM Software Company Pune & MLM Software,Software company,"BLOCK-B7, Lane, behind phoenix mall",
Vyavsaay Digiworld Private Limited,Software company,"OFF-706, Sohrab Hall, 21, Sasoon Rd",020 4600 7198
KSB Tech,Software company,"COMMERCIAL COMPLEX, 42, Bund Garden Rd",
Enthralltech Private Limited,Software company,"The 5th Avenue Office No:D-4, 3rd Floor, Balkrishna Sakharam Dhole Patil Rd",096899 08088
Mwell software solution,Software company,"laxmitara market, SONIGARA PARK, D- 26, Dange Chowk Rd",099604 17935
