name,category,Address
,,
,,
POWERFACTORY UNISEX GYM-THERGAON,Gym,"Onkar Colony, Yashoda Colony, Wakad, Pimpri-Chinchwad, Maharashtra 411033"
GYM TOWN,Gym,"Survey No 19/3, First Floor, Ladhuji Complex Dange Chowk, Opposite Bhoir Hospital Hinjewadi Road, above Ganesh Medicals"
OxyGym fitness centre,Gym,"Oxygym ans fitness centre, Dange Chowk Rd"
Sigma world fitness,Fitness center,near bharat petrol pump
Fitness legacy Gym,Gym,"4th floor, Talreja buisness hub, Datta Mandir Rd"
Crunch Fitness Club,Gym,"2nd floor, Palash Plus, C Building, opposite Euro School"
Moraya Gym - Best Gym In Thergaon Unisex Fitness Centre | Best Rated Gym In Pune | FITNESS Center In Thergaon,Gym,"Barne Estate, Birla Hospital Road, opposite to Padamji Paper Mill"
WILDFIT- An Exclusive Nutrition & Personal Training Studio,Fitness center,"Office no 501, 5th floor, Mi Commercia, Kaspate Wasti Rd, above J & K Bank"
URBAN-FIT,Fitness center,"dimond rock, Anand Park Lane, Bharat Ratna Dr. Babasaheb Ambedkar Marg"
Dynamic Fitness Club,Fitness center,"6th Floor, Rise Alta Prime Plaza, beside Vision One Mall"
"YC'S Power House - Available on cult.fit | Best gym in Hinjewadi, Pune",Gym,Near by legacy celestial vinode nagar wakad
Galaxy Fitness Club,Gym,"Shop no 8/9, JQ92+7PP Galaxy Fitness Club"
"Renaissance Fitness Park - Best Gym in Wakad | Calisthenics, CrossFit, Yoga, Zumba & Advanced Fitness Programs in Wakad",Gym,"Sr. No. 126/1, Beside Olive Orchid Society"
R. K. Health Spa,Fitness center,"opposite, Matoshree Hospital Rd"
OJAS GYM (Unisex) Thergaon,Gym,"Ojas GYM, near surya Ganesh Managal Kendra"
Wild Fitness Gym,Gym,"New BRT Road, Chatrapati Shivaji Maharaj Chowk"
"Fitness Craze - Available on Cult.fit | Best Gym in Pimpri-Chinchwad, Pune",Gym,0
Eon Fitness Empire Gym Tathawade,Fitness center,"Eon Fitness Empire ,Esha-foot Print Society, Opposite Indira National School Tathawade , Pimpri"
Recreation Califitness Club (Calisthenics Gym),Gym,"Recreation cali fitness club, opp. kannu ki chai"
Tiger fitness,Gym,"krantiveer Maharashtra, Tuljai colony lane no1, near sanchiti school"
Body Fitness Gym,Gym,"Chandramauli Garden, Hinjewadi Road"
Golds Gym Wakad,Gym,"S.No. 186, द ओनेस, Kalate Business Park, Kalewadi - Wakad Rd, near Euro School"
Nitrro Redefining Fitness Gym Wakad,Gym,"Austin Plaza, Kasapte Wasti Mhatoba Chauwk, Chatrapati Chowk Rd, opposite Riddhi-Siddhi"
AV FITNESS,Fitness center,Swami vivekananda road
HighFit Fitness Club WAKAD,Gym,Mankar Chowk Rd
FORCE FITNESS,Fitness center,"C2, 2nd Floor, Prime City Centre, Opp, Datta Mandir Rd"
Zenith Calipark (Calisthenics Gym),Gym,"189, 3/2/1, Datta Mandir Rd"
"Marvex Fitness Baner | Gym in Baner, Pune",Gym,"6th Floor, 45 Street, above Atithi Veg Hotel, opposite Dmart"
"1 Repp Gyym, Pune - Available On cult.fit",Gym,"RAJAVEER PALACE, 402, Kunal Icon Rd, above Yes Bank, near Pizza Hut"
"Cult Gym Wakad | Best Gym in Wakad, Pune",Gym,"5th floor, Datta Mandir Rd, above Croma"
AB's Fitness Club,Fitness center,"3rd Floor, Aabai Tower, Datta Mandir Rd"
Muscle Time Fitness [ hinjawadi ],Gym,"Muscle time fitness, bhumkar das road, near hdfc bank, behind the Jogeshwari misal"
ABS FITNESS THERGAON. CHINCHWAD,Fitness center,"Bldg. Sr No 37, Swiss Plaza, Dange Chowk Road, opp. Dilip Vengsarkar Academy"
W FIT GYM,Gym,"3rd Floor, Sanyog Developer Building, Pimple Saudagar Rd, near Mahada Scheme"
S-Square Fitness Club,Gym,"1st Floor, Kokane Heights, Chhatrapati Shivaji Maharaj Chowk, above Rounak Electricals, near Shreeram Vadapav"
FIT-SUM GYM,Gym,"Hulawale, Bendre vasti, Sakhare Vasti Rd, opposite Goodwill PG"
"Marvex Fitness Pimple Saudagar | Gym in Pimple Saudagar, Pune",Gym,"6th Floor, Spot 18 Mall Rahatani Road, Rahatani, Chowk, near Jagtap Dairy"
NEXTFIT Fitness Studio | Near Kokane Chowk,Gym,"Second floor, Vandana Plaza, Kokane Chowk, near AKASHGANGA SOCIETY"
FORCE FITNESS,Fitness center,"KPS Avenue, Ambience Hotel, Road, next to Nisarg City 1, above Rasrang sweets"
Asole's Fitness Freak,Fitness center,"Opposite Kunal Hotel, Main Road, Kalewadi Main Rd"
AV Fitness Studio & Gym,Fitness center,"3rd Floor, SARA Residency, krida nagari, beside Kirti elegant, opposite to SHREE SHIV CHHATRAPATI SPORTS COMPLEX"
Arms Fitness Club - Best Gym in Wakad,Gym,"3rd Floor, Varadaa Arcade, near Eon West IT Park"
Gold's Gym Pimple Saudagar,Gym,"5th Floor, RK Lunkad Business Center, Kokane Chowk, above Reliance fresh"
King Martial Arts & Kickboxing club,Muay Thai boxing gym,0
Akronym Fitness,Gym,"#204, Sai Crystal, New DP Rd"
HighFit Fitness Club (HINJEWADI),Gym,"HIGHFIT FITNESS MARUNJI Sr. no. 261/1, marunji Hinjawadi Road, Marunji Rd, near Bharat medical"
KK Fitness Best gym,Gym,"Anand plaza 1st floor bhondve corner, DY Patil College Rd"
GYM FIT fitness centre,Gym,"Takshan Nagar, near Rashan Cart Landmark Hospital"
B2B Gym Best Gym In Aundh,Gym,"2nd floor, B-wing, Astral Court, Opposite Gaikwad Petrol Pump/Peter Donuts"
Muscle Mania fitness center,Fitness center,"Sai chowk, H.B. - 15/8, near Shani Mandir"
SIX PAX Fitness Centre,Fitness center,0
"Studio Velocity (Baner) - Available on cult.fit | Best Gym in Baner, Pune",Gym,"Survey No. 52/5/3, Platinum Techno Park, 3rd Floor, Plot No. 9, Pashan - Sus Rd, behind Audi Showoom"
ABS FITNESS,Gym,"9th Floor, ICC Trade Tower, A Wing, Senapati Bapat Rd"
Bodykraft fitness studio,Gym,"Bodykraft fitness studio, tapkir chowk, opposite Kaka Halwai"
ABS Fitness Baner Pune.,Fitness center,"38 & 54, Second Floor. WESTPORT. S, 30, Pancard Club Rd"
Niwara Gym by V3 Fitness,Fitness center,"Niwara Campus, 96, Navi Peth"
Forma Fitness Club,Gym,"Hinjawadi Road, Survey No. 10/4"
"M.K fitness club, punawale",Fitness center,"Near Mumbai-pune Highway, Jambe Rd, near lotus business school"
UNIVERSAL FITNESS CLUB,Gym,"Kokane Chowk, above Shakti Sports"
ABS Fitness Club | CAMP,Gym,"Atur Foundation House, 4, Dr Baba Saheb Ambedkar Rd, Above Jawaharlal Nehru Memorial Hall"
.R.Fit N Fine CrossFit Gym,Gym,"JQHC+XRG, Abasaheb Chinchwade Industrial Estate, Walhekar Wadi Rd"
Gold's Gym Hinjawadi ( Bhumkar Chowk ),Gym,"4th Floor, Times Square, Opposite Bharat Petrol Pump, Hinjawadi Phase 1 Rd, near Vitthal Mandir"
MultiFit - Gym in Baner,Gym,"MultiFit, Pancard Club Rd, beside REELICON ALPINE RIDGE, near We Work"
Royal fitness gym,Gym,"Maha ganga colony Maha ganga colony, 111/14/1, Main road, kalewadi, bridge"
NITRRO GYM,Fitness center,Sai Millenium Mall
NEW HARDCORE GYM,Gym,"2 floor, Kamble Plaza opp. Hanuman and Shani Mandir, Jagtap Nagar.6, Thergaon main road"
Golden Fitness Club,Fitness center,"1st Floor, N.B.Arcade, Akurdi, 49/5, Shitla Devi Chowk, near PCMC Hospital"
RD FITNESS GYM (BRANCH-1),Gymnastics center,"Gandharva Nagari Block-G1, GANDHARVA NAGARI, G-1"
"Cult Gym Phase 1, Hinjewadi | Best Gym in Hinjewadi, Pune",Gym,"24, Maan Rd"
Golds Gym Ravet,Gym,"One Mall, S.No. 22/2, 3rd floor, Nirman Properties, Aundh - Ravet BRTS Rd"
Shree Ram Gym,Fitness center,"Sr.No.170/711 2nd Floor, Trimurti Complex, Chikhali Akurdi Rd, near PCMC Hospital"
"C5 Training Space - Xion Mall, Hinjewadi",Gym,"4th floor, Xion Mall, C5 Training Space"
VJS Fitness Club & Swimming Pool,Gym,"Sr no 49, Shivkrupa Dairy Farm, near F Residences"
Sanatoriym Gym pradhikarn 411044,Gym,0
Orca Fitness Gym Udhyamnagar,Gym,"Ajmera Main Rd, near Annasaheb Magar Stadium"
Atenx Performance Studio | Best Fitness Gym in Kothrud Pune,Gym,"Industrial Estate, 10, near Oblique Kitchen"
Brahma Fitness - Available on Cult.fit | Gym in FC Road,Gym,"925, B4, Deendayal Hospital Lane, Tukaram Paduka Chowk, Fergusson college campus Rd"
Trident Fitness Deccan,Gym,"2nd Floor, Opposite Hotel Central Park, Apte Rd, near HDFC Bank"
Fitranger Athfit Studio,Fitness center,Plot No 08
GT Fitness Club,Fitness center,"1st Floor, GRGV+MCC Gurukrupa Complex, Modern Engineering College Rd, off Fergusson College Road"
Gold's Gym,Fitness center,"127/1A, Server Space, A.G.Technology Park, Sarjaa Rd, Sanewadi, Aundh"
ZE Fitness (Gym),Gym,"MRHQ+24J Gandharva Excellence, phase-2 Road, opposite of 11k county society"
Evolution Fitness,Gym,"Evolution gym, 1st floor, RK One building, near shantai hotel, rasta peth, above Saroj Fabric"
Gold's Gym,Fitness center,"127/1A, Server Space, A.G.Technology Park, Sarjaa Rd, Sanewadi, Aundh"
ZE Fitness (Gym),Gym,"MRHQ+24J Gandharva Excellence, phase-2 Road, opposite of 11k county society"
Evolution Fitness,Gym,"Evolution gym, 1st floor, RK One building, near shantai hotel, rasta peth, above Saroj Fabric"
Fitranger Gym,Gym,"Haribhau Sane Krida Sankul, 17/1B, Late GA Kulkarni Path, near Joshi Museum Of Miniature Railways"
Gold’s Gym Moshi Pune,Fitness center,goldfield mall
"Urbounce Gym Baner Pashan | Premium Fitness Gym with Zumba, Yoga, Sauna & Personal Training",Gym,"3rd Floor, HQ2R+5F7, Baner - Pashan Link Rd, near HDFC Bank"
P9 Fitness & Gym,Fitness center,GVF5+G86 Suma Paradise
Universal Gym | Best Gym In Camp Pune,Gym,"Universal Gym & Fitness Club, opp. Chandan Medicals"
THE IRON GYM,Gym,"S. No. 50/11, Kanaskar Bldg Mahadeonagar, Old Mundhwa Rd, near Bollywood Cinema"
Deltoid Fitness,Gym,"1st floor, Sinhgad Rd, behind Navkar Sweets, opposite Datta Krushnai Mangal Karyalaya"
Gold's Gym Baner,Gym,"Imperial Atria, ABIL House, 4th Floor, ABIL Square, Near, Pancard Club Rd"
Body Fuel Fitness Club,Gym,"59, Vishwashanti Marg, near Shiv Chaitanya Hall"
fitness Island GYM,Gym,"33, Gurudwara Rd"
H2O FITNESS CLUB,Gym,"1158, near Lane Number 2"
Anytime Fitness,Fitness center,"4th floor, 10 Biz Park, beside Symbiosis Law School Road"
Raise The Bar Fitness Center,Gym,"2nd Floor, Parmar Gallery, Jagtap Chowk, above Axis Bank"
i Train Fitness Gym,Gym,"Parmar Plaza, next to Inamdar Hospital, opposite Cycle World"
Hayat Fitness Gym,Gym,"1st floor, Riza corner, Chetna garden, 50/65, Lane Number 9"
Gold's Gym Baner,Gym,"Imperial Atria, ABIL House, 4th Floor, ABIL Square, Near, Pancard Club Rd"
Body Fuel Fitness Club,Gym,"59, Vishwashanti Marg, near Shiv Chaitanya Hall"
fitness Island GYM,Gym,"33, Gurudwara Rd"
H2O FITNESS CLUB,Gym,"1158, near Lane Number 2"
Anytime Fitness,Fitness center,"4th floor, 10 Biz Park, beside Symbiosis Law School Road"
Raise The Bar Fitness Center,Gym,"2nd Floor, Parmar Gallery, Jagtap Chowk, above Axis Bank"
i Train Fitness Gym,Gym,"Parmar Plaza, next to Inamdar Hospital, opposite Cycle World"
Hayat Fitness Gym,Gym,"1st floor, Riza corner, Chetna garden, 50/65, Lane Number 9"
Arjun Fitness (GYM),Fitness center,"Sant Gadage Maharaj Vasahat, 42, S Main Rd, near Ambika mata mandir"
Sfc unisex gym,Gym,"link road, Hinjewadi - Wakad Rd"
Nitrro Wellness And Fitness Hub,Gym,"Waterfront Society, Vithalrao Vandekar Rd"
WILDFIT-An Exclusive Nutrition & Personal Training Studio,Gym,"WISE, Building 2, Plot No. 44, Hindustan Estates, Road No. E, near Nilanjali Society"
XUMO Fitness,Fitness center,"Ground floor, Mahalaxmi Vihar Complex, Chowk, behind Bank of Maharashtra, next to Mahalaxmi Diagnostic Center"
Arjun Fitness (GYM),Fitness center,"Sant Gadage Maharaj Vasahat, 42, S Main Rd, near Ambika mata mandir"
Sfc unisex gym,Gym,"link road, Hinjewadi - Wakad Rd"
Nitrro Wellness And Fitness Hub,Gym,"Waterfront Society, Vithalrao Vandekar Rd"
WILDFIT-An Exclusive Nutrition & Personal Training Studio,Gym,"WISE, Building 2, Plot No. 44, Hindustan Estates, Road No. E, near Nilanjali Society"
XUMO Fitness,Fitness center,"Ground floor, Mahalaxmi Vihar Complex, Chowk, behind Bank of Maharashtra, next to Mahalaxmi Diagnostic Center"
OXOFIT PREMIUM FITNESS - Available on cult.fit,Gym,"Ruia Chambers, Amanora"
Ethos- Republic Of Strength,Gym,"1214, Road No. 4, near Pabalkar Hospital"
RM Fitness Studio,Gym,"4th floor, CT Survey no 20/21, opposite Mahadev Temple"
The Gym,Gym,"Ganga Home, Row House No.1/2, next to Bank Of India"
27 CrossthonFit pune,Gym,"Balgandharva Mandir Premises, 1204/4, Jangali Maharaj Rd"
Vibrant gym,Physical fitness program,"Sarvy no- 759/38, Kamal Manohar Basement, near Good Luck Cafe, near Suvarna Smruti Hall"
Symbiosis Fitness Centre,Gym,"GRXQ+QRG, Pune"
Evolve Fitness & Wellness Club,Gym,"Sixth Floor, One Place, Salunke Vihar Rd, above Third Wave Coffee"
Spa Fitness,Gym,"4th floor, Vikram Nandadeep Apartments, Senapati Bapat Rd, opposite Patrakar Nagar"
POWER HOUSE GYM & FITNESS STUDIO,Gym,"Second floor, Ganga Complex, society, opp. to business bay"
Cosmic Fitness Gym - Pune,Gym,"2nd Floor, Vatsalya Building, opposite Mountain High Hotel"
FIT N FINE FITNESS GYM,Gym,0
"Rising Fitness Club, Camp Branch",Fitness center,"2405 east street camp pune Above Sujata Mastani, Juna Pulgate, near Burger King, next to LIC building"
Gymlife (Gym &Cricket turf),Gym,Kapil Nagar St
"Urbounce Gym, Fergusson College Road Branch",Gym,"925, B4, Deendayal Hospital Lane Tukaram Paduka, Chowk, Fergusson College Rd"
